{
  "$schema": "http://json-schema.org/draft-07/schema#",
  "$id": "clarify-questions.schema.json",
  "title": "Clarify Questions",
  "type": "object",
  "required": ["id", "type", "questions"],
  "properties": {
    "id": { "type": "string" },
    "type": { "const": "clarifyQuestions" },
    "title": { "type": "string" },
    "subtitle": { "type": "string" },
    "layout": { "type": "object", "properties": { "width": { "enum": ["oneThird", "oneHalf", "full"], "default": "full" } } },
    "meta": { "$ref": "card-base.schema.json#/properties/meta" },
    "actions": { "$ref": "card-base.schema.json#/properties/actions" },
    "menuItems": { "$ref": "card-base.schema.json#/properties/menuItems" },
    "questions": {
      "type": "array",
      "items": {
        "type": "object",
        "required": ["id", "label", "type"],
        "properties": {
          "id": { "type": "string" },
          "label": { "type": "string" },
          "type": { "enum": ["text", "choice"] },
          "options": { "type": "array", "items": { "type": "string" } }
        },
        "additionalProperties": false
      }
    }
  },
  "additionalProperties": false
}


